id,state,bill_number,name,most_recent_action,action_date,current_legislative_status,categories
2990,AK,HB66,"Elections, Voting, Ballots",NOT TAKEN UP - ADJOURNED SINE DIE,2022-05-18,Dead,"Absentee/mail-in ballot return processes,States of emergency,Cure provisions,In-person voting and polling places,Enforcement against officials,Enforcement against non-officials,Voter registration,Voting equipment,Cybersecurity"
2798,AK,SB161,Political Party Definition,AWAITING TRANSMITTAL TO GOV,2022-05-18,Passed both chambers,Ballot access for parties
2949,AK,SB39,Ballot Custody/tampering; Voter Reg; Mail,Senate Finance Hearing (13:00 5/3/2022 Senate Finance 532),2022-05-03,Introduced,"Absentee/mail-in ballot deadlines,Absentee/mail-in ballot administration,Poll observers,States of emergency,Counting and canvassing procedures,Provisional ballots,Enforcement against non-officials,Voter registration"
35,AK,SB167,Elections; Fraud; Ballots,Senate State Affairs Hearing (15:30 4/28/2022 Butrovich 205),2022-04-28,Introduced,"Absentee/mail-in ballot return processes,Poll observers,Cure provisions,Counting and canvassing procedures,Voter registration,In-person voter assistance,Physical security,Cybersecurity"
2661,AK,HB381,Repeal Ballot Measure 2 Re: Elections,COSPONSOR(S): RAUSCHER,2022-04-19,Introduced,"Poll observers,Oversight and accountability,Ballot access for candidates,Counting and canvassing procedures,Election dates and administrative deadlines,In-person voting and polling places,Private funding,In-person voter assistance,Absentee/mail-in voter assistance"
2663,AK,SB209,Elections; Fraud; Ballots,REFERRED TO STATE AFFAIRS,2022-02-22,Introduced,"Absentee/mail-in ballot return processes,Cure provisions,Chain of custody"
2662,AK,HB390,"Voter Registration, Hand-count Districts",REFERRED TO STATE AFFAIRS,2022-02-22,Introduced,"Absentee/mail-in ballot administration,Counting and canvassing procedures"
2660,AK,HB368,Election Transparency,REFERRED TO STATE AFFAIRS,2022-02-22,Introduced,"Counting and canvassing procedures,In-person voting and polling places,In-person voter assistance"
32,AK,HB286,Elections; Fraud; Ballots,JUD REFERRAL ADDED AFTER STA,2022-01-21,Introduced,"Permanent lists,Cure provisions,Signature matching,Enforcement against officials,Enforcement against non-officials,Chain of custody,Physical security"
36,AK,SB82,Elections; Election Investigations,REFERRED TO STATE AFFAIRS,2021-04-28,Introduced,"Oversight and accountability,Enforcement against officials,Enforcement against non-officials"
31,AK,HB23,Ballot Custody/tamper; Voting; Voter Reg,COSPONSOR(S): MCCARTY,2021-04-16,Introduced,"Cure provisions,Enforcement against non-officials,Chain of custody,Physical security"
30,AK,HB138,Voting By Mail,REFERRED TO JUDICIARY,2021-04-09,Introduced,"Absentee/mail-in ballot administration,Drop-box availability,Audits,Language accommodations,Counting and canvassing procedures,In-person voting and polling places,Enforcement against officials,Enforcement against non-officials,Voter registration,Cybersecurity"
33,AK,HB95,Elections; Election Investigations,REFERRED TO STATE AFFAIRS,2021-02-18,Introduced,"Oversight and accountability,Enforcement against officials,Enforcement against non-officials"
34,AK,HB96,Elections; Voting; Ballot Reqs,REFERRED TO STATE AFFAIRS,2021-02-18,Introduced,"Voter ID for absentee/mail-in ballots,Voting materials,Counting and canvassing procedures,Recounts,Chain of custody"
37,AK,SB83,Elections; Voting; Ballot Reqs,REFERRED TO STATE AFFAIRS,2021-02-12,Introduced,Voter ID for absentee/mail-in ballots
9,AL,HB144,"Elections, eliminating requirement for runoff election where only two candidates run in municipal election and there is a tie, providing that judge of probate, rather than sheriff, to decide where there is tie vote in election for county or precinct office","Delivered to Governor at 9:46 a.m. on April7, 2022.",2022-04-07,Passed both chambers,"Municipal election procedures,Counting and canvassing procedures,Certification"
12,AL,HB194,"Elections, prohibits state and local election officials and their employees from soliciting, accepting, using, or disposing of certain donations from individuals or nongovernmental entities for funding certain election-related expenses","Delivered to Governor at 3:24 p.m. on April 7, 2022.",2022-04-07,Passed both chambers,"Private funding,Enforcement against non-officials"
17,AL,HB239,"Elections, prohibiting poll watchers from assisting an individual with voting, Secs. 11-46-51, 17-9-13 am'd.",Pending third reading on day 29 Favorable from Fiscal Responsibility and Economic Development,2022-04-06,Passed one chamber,"Poll observers,In-person voting and polling places,In-person voter assistance"
22,AL,HB63,"Elections, prefilling of any field on voter registration application or absentee ballot application, prohibited, criminal penalties for violations imposed, Secs. 17-3-54, 17-11-4 am'd.",Fiscal Responsibility and Economic Development first Amendment Offered,2022-04-06,Passed one chamber,"Absentee/mail-in ballot request processes,Enforcement against non-officials,Voter registration,Absentee/mail-in voter assistance"
2710,AL,SB279,"Courts, the further provide for the election of justices of the Supreme Court and judges of the appellate courts, Sec. 12-3-4 repealed; Secs. 12-2-1, 12-3-2, 12-3-3, 12-3-4, 17-6-48, 17-6-48.1 am'd.",Senate JUDY Hearing (08:30 3/30/2022 Room 325),2022-03-30,Introduced,"Ballot access for candidates,Vacancy procedures,Ballot access deadlines"
2711,AL,SB287,"Elections, provide for election of associate justices of the Supreme Court and judges of the appellate courts, const. amend.",Senate JUDY Hearing (08:30 3/30/2022 Room 325),2022-03-30,Introduced,Ballot measures (initiative and referendum)
2665,AL,SB249,"Elections, voter fraud, election offenses, revising and consolidating election offenses, Secs. 17-1-6, 17-1-7, 17-1-8, 17-9-50.2, 17-9-52 added; Secs. 17-17-1 to 17-17-56, inclusive, repealed; Secs. 17-1-5, 17-9-50 am'd.",Further Consideration,2022-03-15,Advanced from committee,"Enforcement against non-officials,Physical security"
2709,AL,SB268,"Elections, prefilling of any field on voter registration application or absentee ballot application, prohibited, criminal penalties for violations imposed, Secs. 17-3-54, 17-11-4 am'd.",Further Consideration,2022-03-15,Advanced from committee,"Absentee/mail-in ballot request processes,Voter registration,In-person voter assistance,Absentee/mail-in voter assistance"
2915,AL,SB32,"Legislature, courts, civil procedure, authority of members of Legislature to intervene in certain legal actions, provided",Pending third reading on day 21 Favorable from Judiciary with 1 amendment,2022-03-09,Advanced from committee,"Oversight and accountability,Legislative authority"
2728,AL,HB448,"Elections, election officials, permitted to work split shift schedule on election day if approved by judge of probate, Secs. 11-46-27, 17-8-1 am'd.","Read for the first time and referred to the House of Representatives committee on Constitution, Campaigns and Elections",2022-03-03,Introduced,"In-person voting and polling places,Election workers/volunteers,Election officials"
2651,AL,HB342,"Elections, electronic vote counting systems, use of electronic vote counting systems capable of connecting to the Internet or cell phone networks, or that possess modem technology are prohibited, Sec. 17-7-21 am'd.","Constitution, Campaigns and Elections first Amendment Offered",2022-03-02,Introduced,"Counting and canvassing procedures,Certification,Voting equipment,Cybersecurity"
16,AL,HB225,"Absentee voting, eliminating requirement that affidavit accompanying absentee ballot be witnessed or notarized, Sec. 17-11-7, 17-11-10 am'd.","Pending third reading on day 18 Favorable from Constitution, Campaigns and Elections",2022-03-02,Advanced from committee,"Absentee/mail-in ballot return processes,Witness or notary requirements"
8,AL,HB131,"Elections, voter lists, judge of probate to place public voter lists on Internet public notice website maintained by Sec. of State, counties authorized to opt out, municipalities authorized to publish municipal voter lists on Sec. of State notice website, Secs. 11-46-36, 17-4-1 am'd.",House CC&E Hearing (09:30 3/2/2022 Capital S-201),2022-03-02,Introduced,Voter list maintenance
2664,AL,HB396,"Elections, judge of probate, authorized to appoint high school students to work as precinct election officials","Read for the first time and referred to the House of Representatives committee on Constitution, Campaigns and Elections",2022-02-22,Introduced,"Election workers/volunteers,Election officials"
11,AL,HB193,"Elections, absentee voting and absentee ballot collection, prohibiting any person from accepting or receiving payment for any process relating to absentee ballots",Pending third reading on day 12 Favorable from Judiciary with 1 substitute and 1 amendment,2022-02-16,Advanced from committee,"Absentee/mail-in ballot return processes,Chain of custody"
28,AL,SB46,"Elections, electronic vote counting systems, use of electronic vote counting systems capable of connecting to the Internet or cell phone networks, or that possess modem technology are prohibited, Sec. 17-7-21 am'd.","Pending third reading on day 12 Favorable from Constitution, Campaigns and Elections with 1 amendment",2022-02-16,Passed one chamber,"In-person voting and polling places,Voting equipment,Digital/electronic voting,Cybersecurity"
19,AL,HB317,"Legislature, term limits of two terms plus two years in each house provided, prior service not counted, const. amend.",House CC&E Hearing (09:30 2/16/2022 Capitol S-201),2022-02-16,Introduced,"Ballot access for candidates,Ballot measures (initiative and referendum)"
27,AL,SB29,"Elections, prefilling of any field on voter registration application or absentee ballot application, prohibited, criminal penalties for violations imposed, Secs. 17-3-54, 17-11-4 am'd.",Senate JUDY Hearing (08:30 2/16/2022 Room 325),2022-02-16,Introduced,"Absentee/mail-in ballot request processes,Enforcement against non-officials,Voter registration,Absentee/mail-in voter assistance"
2583,AL,HB374,"Elections, voters and voting, providing procedures for an elector to vote when he or she has changed domicile, Sec. 17-9-10 am'd.",Read for the first time and referred to the House of Representatives committee on State Government,2022-02-16,Introduced,"Counting and canvassing procedures,In-person voting and polling places,Provisional ballots"
25,AL,SB143,"Elections, public testing of voting machines, Sec. 17-7-21 am'd.",Senate GA Hearing (13:00 2/8/2022 Room 825),2022-02-08,Introduced,"Voting equipment,Cybersecurity"
14,AL,HB217,"Absentee voting, authorize without providing excuse, Secs. 17-11-3, 17-11-7 am'd.","Read for the first time and referred to the House of Representatives committee on Constitution, Campaigns and Elections",2022-02-02,Introduced,"Absentee/mail-in voting eligibility,Absentee/mail-in ballot request processes"
15,AL,HB218,"Elections, early voting, authorize voting during four to six day period immediately preceding election day","Read for the first time and referred to the House of Representatives committee on Constitution, Campaigns and Elections",2022-02-02,Introduced,"Early voting administration,Early voting duration"
13,AL,HB204,"Elections, county canvassing board to conduct post-election audit, November 2020 general election",Read for the first time and referred to the House of Representatives committee on Ways and Means General Fund,2022-02-02,Introduced,"Audits,Poll observers,Oversight and accountability"
10,AL,HB168,"Absentee voting, authorize without providing excuse, Secs. 17-11-3, 17-11-7 am'd.","Read for the first time and referred to the House of Representatives committee on Constitution, Campaigns and Elections",2022-01-18,Introduced,Absentee/mail-in voting eligibility
7,AL,HB103,"Election, early voting, in-person voting period, authorized","Read for the first time and referred to the House of Representatives committee on Constitution, Campaigns and Elections",2022-01-11,Introduced,"Early voting administration,Early voting duration"
21,AL,HB41,"Elections, prohibits state and local election officials and their employees from soliciting, accepting, using, or disposing of certain donations from individuals or nongovernmental entities for funding certain election-related expenses","Read for the first time and referred to the House of Representatives committee on Constitution, Campaigns and Elections",2022-01-11,Introduced,"Private funding,Enforcement against officials"
23,AL,HB74,"Elections, prohibits the solicitation, receipt, or use of private funds to administer an election, with exceptions","Read for the first time and referred to the House of Representatives committee on Constitution, Campaigns and Elections",2022-01-11,Introduced,Private funding
3068,AZ,SB1255,Lieutenant governor; duties; ballot,Chapter 349,2022-07-06,Enacted,Ballot access for candidates
3067,AZ,SB1411,Early ballots; tracking system,Chapter 358,2022-07-06,Enacted,"Absentee/mail-in ballot return processes,Absentee/mail-in ballot administration,State appropriations"
3066,AZ,HB2243,Voter registration; state residency; cancellation,Chapter 370,2022-07-06,Enacted,"Voter registration,Voter list maintenance"
3047,AZ,HCR2015,Initiatives; supermajority vote; requirement,Transmitted to Secretary Of State,2022-06-24,Enacted,Ballot measures (initiative and referendum)
3069,AZ,SCR1024,Lieutenant governor; joint ticket,Transmitted to Secretary Of State,2022-06-24,Enacted,"Ballot access for candidates,Vacancy procedures"
80,AZ,SB1259,Recounts; requests; procedures; audits,Senate concurs,2022-06-24,Conference committee,"Audits,Counting and canvassing procedures,Recounts,Provisional ballots,Testing and certification"
3004,AZ,HB2710,Registrations; counting procedures; observers; verification,House Conference Committee recommended,2022-06-24,Conference committee,"Poll observers,Signature matching,Counting and canvassing procedures,Voter registration,Testing and certification,Chain of custody"
48,AZ,HB2402,Automatic voter registration; same day.,Introduced in House and read first time,2022-06-23,Introduced,"Legal causes of action,Voter registration,Same-day/Election Day registration,Automatic voter registration"
71,AZ,SB1012,Registration database; federal voters; report,Introduced in House and read first time,2022-06-23,Passed one chamber,"Oversight and accountability,Transparency,Enforcement against non-officials,Voter list maintenance"
40,AZ,HB2092,Ballot measure amendments,Introduced in House and read first time,2022-06-23,Introduced,"Ballot measures (initiative and referendum),Ballot design,Voting materials"
42,AZ,HB2194,National popular vote; interstate agreement,Introduced in House and read first time,2022-06-23,Introduced,"Presidential elections,National Popular Vote Interstate Compact"
70,AZ,HCR2033,Decertifying Arizona's 2020 electors,Introduced in House and read first time,2022-06-23,Introduced,"Enforcement against officials,Legislative authority"
63,AZ,HB2771,Election procedures; registrations; campaign finance,Introduced in House and read first time,2022-06-23,Introduced,"Audits,Ballot access for candidates,Voter ID for registration,Counting and canvassing procedures,Early voting administration,Early voting duration,In-person voting and polling places,Noncitizen voting,Voter registration,Voter list maintenance,Same-day/Election Day registration,Cybersecurity"
68,AZ,HB2786,Voter registrations; ballot requests; source,SENATE - Ugenti-Rita flr amend (ref Bill) adopted,2022-06-23,Passed one chamber,"Absentee/mail-in ballot deadlines,Drop-box availability,Oversight and accountability,States of emergency,Signature matching,In-person voting and polling places,Voter list maintenance,In-person voter assistance,Absentee/mail-in voter assistance,Military/UOCAVA voting,Drop-box security"
62,AZ,HB2770,Voting centers; board of supervisors,Introduced in House and read first time,2022-06-23,Introduced,"Oversight and accountability,Early voting administration,In-person voting and polling places"
66,AZ,HB2780,Voter lists; images; voting records,Senate Committee of the Whole action: Do Pass Amended,2022-06-23,Passed one chamber,"Audits,Oversight and accountability,Transparency,Counting and canvassing procedures,Voter list maintenance,Chain of custody"
51,AZ,HB2493,Election integrity fund,Senate Committee of the Whole action: Do Pass Amended,2022-06-22,Passed one chamber,"Oversight and accountability,Voting equipment"
2683,AZ,SB1170,G&F; tags; permits; voter registration,Governor Signed,2022-06-07,Enacted,Voter registration
3019,AZ,SB1013,Secretary of state; federal form,Governor Signed,2022-06-06,Enacted,Voter registration
84,AZ,SB1362,Early ballot on-site tabulation,Governor Signed,2022-06-06,Enacted,"Counting and canvassing procedures,In-person voting and polling places,Voting equipment"
2992,AZ,SB1260,Registrations; early voting; move notice,Chapter 270,2022-06-06,Enacted,"Absentee/mail-in ballot administration,Early voting administration,Legal causes of action,Voter registration,Voter list maintenance"
2729,AZ,HB2617,Voter registration; cancellations; causes,Governor Vetoed,2022-05-27,Vetoed,"Voter registration,Voter list maintenance"
43,AZ,HB2236,Voter registration; request required,Chapter 259,2022-05-27,Enacted,Automatic voter registration
3021,AZ,HB2703,Secure online signature collection,Chapter 266,2022-05-27,Enacted,Signature matching
47,AZ,HB2378,Election lawsuits; settlements; approvals,Senate third reading FAILED voting: (15-14-1-0),2022-05-23,Passed one chamber,Legal causes of action
89,AZ,SB1477,Voter registration; felonies; clerk; database,Chapter 251,2022-05-23,Enacted,"Voter registration,Voter list maintenance"
44,AZ,HB2237,Same day voter registration; prohibition,Governor Signed,2022-05-23,Enacted,"Enforcement against officials,Same-day/Election Day registration"
45,AZ,HB2238,Ballot drop boxes; prohibition,Senate third reading FAILED voting: (14-15-1-0),2022-05-23,Passed one chamber,"Drop-box availability,In-person voter assistance,Drop-box security"
3008,AZ,SB1008,Elections; recount margin,Chapter 230,2022-05-20,Enacted,Recounts
41,AZ,HB2170,Election mailings; third-party disclosures,Senate motion to reconsider third reading,2022-05-17,Passed one chamber,Transparency
50,AZ,HB2492,Voter registration; verification; citizenship,Governor Signed,2022-03-30,Enacted,Voter registration
52,AZ,HB2494,Voter registration events; posting,Senate majority caucus: Do pass,2022-03-22,Passed one chamber,Voter registration
67,AZ,HB2783,Election law violations; procedures manual,Senate read second time,2022-03-17,Passed one chamber,"Oversight and accountability,Cybersecurity"
2777,AZ,SB1476,Ballot numbering; custody,Senate third reading FAILED voting: (14-15-1-0),2022-03-14,Advanced from committee,"Ballot design,Physical security"
92,AZ,SB1570,Election equipment; security; results; tabulation,Senate third reading FAILED voting: (14-15-1-0),2022-03-14,Advanced from committee,"Counting and canvassing procedures,Enforcement against non-officials,Voting equipment,Chain of custody,Physical security"
83,AZ,SB1360,Election observers; access,Senate third reading FAILED voting: (15-14-1-0),2022-03-14,Advanced from committee,Poll observers
75,AZ,SB1056,Misplaced ballots; invalidity; misdemeanor; damages,Senate third reading FAILED voting: (15-14-1-0),2022-03-14,Advanced from committee,"Provisional ballots,Enforcement against non-officials,Legal causes of action,Chain of custody"
94,AZ,SB1572,Voting list; images; cast votes,Senate third reading FAILED voting: (14-15-1-0),2022-03-14,Advanced from committee,"Transparency,Counting and canvassing procedures,Voter registration,Voter list maintenance"
74,AZ,SB1055,Election process; contractors and contracts,Senate third reading FAILED voting: (15-14-1-0),2022-03-14,Advanced from committee,"Enforcement against non-officials,Legal causes of action,Voting equipment"
82,AZ,SB1359,Election workers; unique passwords,Senate third reading FAILED voting: (14-15-1-0),2022-03-14,Advanced from committee,Cybersecurity
2784,AZ,SB1457,Voting machines; hardware; software; access,Senate third reading FAILED voting: (14-15-1-0),2022-03-14,Advanced from committee,"Testing and certification,Digital/electronic voting,Cybersecurity"
38,AZ,HB2041,Ballot fraud countermeasures; paper; ink,Transmitted to Secretary Of State,2022-03-10,Introduced,Voting materials
98,AZ,SB1629,Registration; verification; images; audits; boxes,Senate motion to reconsider third reading,2022-03-09,Advanced from committee,"Audits,Oversight and accountability,Transparency,Signature matching,Counting and canvassing procedures,State appropriations,Legal causes of action,Voter registration,Voter list maintenance"
99,AZ,SB1642,Election management systems; security,Senate third reading FAILED voting: (14-14-2-0),2022-03-09,Advanced from committee,"Voting equipment,Ballot collection,Physical security,Cybersecurity"
78,AZ,SB1120,Ballot fraud countermeasures; paper; ink.,Senate Committee of the Whole action: Retained,2022-03-09,Advanced from committee,"Ballot design,Voting materials,State appropriations"
88,AZ,SB1460,Election law amendments,Senate Committee of the Whole action: Retained,2022-03-08,Advanced from committee,"Transparency,States of emergency,In-person voting and polling places,Provisional ballots,Redistricting,Voter registration,Voter list maintenance"
2742,AZ,HB2839,Candidate nominations; signatures; redistricting.,Governor Signed,2022-03-03,Enacted,Ballot access for candidates
77,AZ,SB1063,Legislative vacancies; precinct committeemen,Senate motion to reconsider third reading,2022-03-02,Advanced from committee,Vacancy procedures
2690,AZ,SCR1012,Voter identification; affidavit; procedure,Transmitted to Secretary Of State,2022-03-01,Passed both chambers,"Absentee/mail-in ballot return processes,Voter ID for absentee/mail-in ballots,In-person voter ID,Provisional ballots"
2700,AZ,HCR2025,Voter identification; voting,House additional Committee of the Whole action: Do Pass Amended,2022-02-28,Advanced from committee,"Absentee/mail-in ballot request processes,Voter ID for absentee/mail-in ballots,In-person voter ID,In-person voting and polling places,Absentee/mail-in voter assistance"
93,AZ,SB1571,Ballot drop boxes; surveillance; appropriation,Senate majority caucus: Do pass,2022-02-23,Advanced from committee,"Early voting administration,State appropriations,Drop-box security,Video surveillance"
95,AZ,SB1576,Tabulating equipment; fractional votes; manual,Senate majority caucus: Do pass,2022-02-21,Advanced from committee,Voting equipment
76,AZ,SB1058,Drive-up voting; prohibition,Senate majority caucus: Do pass,2022-02-21,Advanced from committee,"Drop-box availability,Election workers/volunteers,Drop-box security"
79,AZ,SB1169,Email; prohibition; political campaigns,Senate Government (14:00 2/17/2022 SHR 1),2022-02-17,Introduced,Legal causes of action
61,AZ,HB2743,Elections; identification; revisions; mail-in; tabulation,House read second time,2022-02-10,Introduced,"Absentee/mail-in voting eligibility,Absentee/mail-in ballot administration,Oversight and accountability,Ballot design,Counting and canvassing procedures,Recounts,In-person voting and polling places,Legal causes of action,Voting equipment"
64,AZ,HB2772,Ballot measures; foreign contributions; prohibition,House read second time,2022-02-10,Introduced,"Ballot measures (initiative and referendum),Private funding"
65,AZ,HB2778,Electronic registration information center; prohibition,House read second time,2022-02-09,Introduced,"Voter registration,Cybersecurity"
57,AZ,HB2598,Transportation tax; election; Maricopa county.,"House TRANS Committee action: Do Pass Amended, voting: (8-3-0-1-0-0)",2022-02-09,Advanced from committee,Ballot measures (initiative and referendum)
59,AZ,HB2680,Voter registration; same day,House read second time,2022-02-08,Introduced,"Provisional ballots,Same-day/Election Day registration"
56,AZ,HB2596,Elections; revisions; mail-in; identification; tabulation,House read second time,2022-02-02,Introduced,"Absentee/mail-in voting eligibility,Absentee/mail-in ballot request processes,Absentee/mail-in ballot administration,Audits,Oversight and accountability,Ballot design,Voting materials,Vacancy procedures,Counting and canvassing procedures,In-person voting and polling places,Electioneering,Legal causes of action,Testing and certification,Digital/electronic voting"
97,AZ,SB1612,Election equipment; prohibited providers,Senate read second time,2022-02-02,Introduced,Voting equipment
96,AZ,SB1608,Precinct tabulation; verification; elections,Senate read second time,2022-02-02,Introduced,"Counting and canvassing procedures,Recounts"
101,AZ,SCR1046,Voter identification; Arizona card,Senate read second time,2022-02-02,Introduced,"In-person voter ID,Provisional ballots,In-person voter assistance"
90,AZ,SB1503,Registration; voting; jails; confinement,Senate read second time,2022-02-01,Introduced,"Early voting eligibility,Voting by felons or incarcerated individuals,Voter registration"
91,AZ,SB1543,Election and ethics; commission; duties,Senate read second time,2022-02-01,Introduced,"Audits,Vacancy procedures"
86,AZ,SB1453,Automatic voter registration; same day,Senate read second time,2022-01-31,Introduced,"Same-day/Election Day registration,Automatic voter registration"
87,AZ,SB1456,Presidential preference caucuses; independent voters,Senate read second time,2022-01-31,Introduced,"Oversight and accountability,Ballot access for candidates,Primary systems,Counting and canvassing procedures,Voter list maintenance,Testing and certification,Digital/electronic voting"
100,AZ,SCR1037,Conduct of elections; voters' rights,Senate read second time,2022-01-31,Introduced,Legal causes of action
85,AZ,SB1433,Voters; false communication; enterprises; enforcement,Senate read second time,2022-01-27,Introduced,"Enforcement against non-officials,Legal causes of action"
55,AZ,HB2581,State candidates; nomination; fee,House read second time,2022-01-25,Introduced,Ballot access for candidates
53,AZ,HB2557,School district candidates; ballots,House read second time,2022-01-25,Introduced,"Ballot access for candidates,Municipal election procedures"
54,AZ,HB2577,Voter identification; ballots; delivery; process,House read second time,2022-01-25,Introduced,"Absentee/mail-in ballot deadlines,Absentee/mail-in ballot request processes,In-person voter ID,Voter ID for registration,In-person voting and polling places,Legal causes of action,Drop-box security"
49,AZ,HB2444,Clean elections; county candidates,House read second time,2022-01-25,Introduced,"Ballot access for candidates,Municipal election procedures"
73,AZ,SB1028,Ballot paper; security measures,"Senate GOV Committee action: Held, voting: (0-0-0-0)",2022-01-24,Introduced,"Voting materials,Cybersecurity"
39,AZ,HB2059,Early voting; boxes; observers; electioneering,House read second time,2022-01-19,Introduced,"Counting and canvassing procedures,Early voting administration,In-person voting and polling places,Enforcement against non-officials,Challenges,Drop-box security"
72,AZ,SB1027,Election bureau; complaint; investigation,Senate read second time,2022-01-11,Introduced,"Oversight and accountability,State appropriations,Enforcement against non-officials,Legal causes of action,Challenges"
2585,CA,SB1061,Elections: voter registration.,"Assembly Appropriations Hearing (09:00 8/3/2022 1021 O Street, Room 1100)",2022-08-03,Passed one chamber,"Special election procedures,Vacancy procedures,State appropriations"
2606,CA,SB1131,Election workers: confidentiality.,"Assembly Appropriations Hearing (09:00 8/3/2022 1021 O Street, Room 1100)",2022-08-03,Passed one chamber,"Transparency,State appropriations,Enforcement against non-officials,Election workers/volunteers,Election officials,Legal causes of action,Physical security"
136,CA,SB103,Uniform Faithful Presidential Electors Act.,"Assembly Appropriations Hearing (09:00 8/3/2022 1021 O Street, Room 1100)",2022-08-03,Passed one chamber,Presidential elections
2830,CA,AB2967,Elections: petition records and requests: vote-by-mail ballot.,"Senate Appropriations Hearing (10:00 8/1/2022 1021 O Street, Room 2200)",2022-08-01,Passed one chamber,"Cure provisions,Signature matching,Recalls,State appropriations"
2637,CA,AB2815,Elections: vote by mail ballot drop-off locations.,"Senate Appropriations Hearing (10:00 8/1/2022 1021 O Street, Room 2200)",2022-08-01,Passed one chamber,"Drop-box availability,State appropriations"
2635,CA,AB2608,Vote by mail ballot applications.,"Senate Appropriations Hearing (10:00 8/1/2022 1021 O Street, Room 2200)",2022-08-01,Passed one chamber,Military/UOCAVA voting
117,CA,AB1848,Redistricting: copies of district maps.,"Senate Appropriations Hearing (10:00 8/1/2022 1021 O Street, Room 2200)",2022-08-01,Passed one chamber,"Voting by felons or incarcerated individuals,Redistricting process"
2634,CA,AB2584,Recall elections.,"Senate Appropriations Hearing (10:00 8/1/2022 1021 O Street, Room 2200)",2022-08-01,Passed one chamber,"Recalls,State appropriations,Legal causes of action"
2638,CA,AB2841,Disqualification from voting: conservatorship.,"Senate Appropriations Hearing (10:00 8/1/2022 1021 O Street, Room 2200)",2022-08-01,Passed one chamber,"Transparency,State appropriations,Voter registration,Voter list maintenance"
105,CA,AB1416,Elections: ballot label.,"Senate Appropriations Hearing (10:00 8/1/2022 1021 O Street, Room 2200)",2022-08-01,Passed one chamber,"Ballot measures (initiative and referendum),Ballot design,State appropriations"
111,CA,AB1619,Elections: voter registration and signature comparison.,Enrolled and presented to the Governor at 11:30 a.m.,2022-07-11,Passed both chambers,"Cure provisions,Signature matching"
122,CA,AB2037,Polling places: alcoholic beverages.,Read second time. Ordered to third reading.,2022-06-30,Passed one chamber,Electioneering
2632,CA,AB2577,Elections: state offices: uniform candidate filing system.,In Assembly. Concurrence in Senate amendments pending.,2022-06-30,Passed both chambers,Ballot access for candidates
3059,CA,SB131,"November 8, 2022, statewide general election: ballot measures.","Chaptered by Secretary of State. Chapter 65, Statutes of 2022.",2022-06-30,Enacted,Ballot measures (initiative and referendum)
2641,CA,SB1480,Remote accessible vote by mail systems.,June 29 set for first hearing canceled at the request of author.,2022-06-29,Passed one chamber,"Absentee/mail-in ballot administration,State appropriations"
3058,CA,AB213,"November 8, 2022, statewide general election: ballot measures.",Read second time. Ordered to third reading.,2022-06-28,Passed one chamber,Ballot measures (initiative and referendum)
2833,CA,AB1631,Elections: elections officials.,In committee: Referred to suspense file.,2022-06-27,Passed one chamber,"Transparency,Language accommodations,State appropriations"
2633,CA,AB2582,Recall elections: local offices.,Read second time. Ordered to third reading.,2022-06-22,Passed one chamber,Recalls
3053,CA,ACA16,Elections: partisan primaries.,From printer. May be heard in committee July 21.,2022-06-21,Introduced,Primary systems
112,CA,AB1652,County boards of education: members: charter school employees.,From committee: Do pass and re-refer to Com. on E. & C.A. (Ayes 6. Noes 0.) (June 1). Re-referred to Com. on E. & C.A.,2022-06-01,Passed one chamber,Municipal election procedures
119,CA,AB1872,Election day holiday.,In committee: Held under submission.,2022-05-19,Advanced from committee,"State appropriations,Time off for voting"
2631,CA,AB2576,Voter registration and outreach programs.,In committee: Held under submission.,2022-05-19,Advanced from committee,"Voting materials,State appropriations,Election workers/volunteers,Voter registration"
2584,CA,AB2161,Gubernatorial recall elections.,"In committee: Set, first hearing. Testimony taken.",2022-04-27,Introduced,"Ranked-choice voting,Recalls,State appropriations"
115,CA,AB1696,Elections: military or overseas voters.,"Assembly Elections Hearing (09:00 4/27/2022 State Capitol, Room 444)",2022-04-27,Introduced,"Ballot access for candidates,State appropriations"
2614,CA,AB2411,Voting: ballot design.,"Assembly Elections Hearing (09:00 4/27/2022 State Capitol, Room 444)",2022-04-27,Introduced,"Transparency,Ballot design"
113,CA,AB1660,Elections: vote by mail ballots: notifications.,"In committee: Set, second hearing. Failed passage.",2022-04-27,Introduced,Absentee/mail-in ballot return processes
2640,CA,SB1381,School districts and community college districts: governing board elections: charter cities.,April 20 set for final hearing canceled at the request of author.,2022-04-20,Introduced,Municipal election procedures
118,CA,AB1849,Measures submitted to the voters: private corporations.,"Assembly Elections Hearing (09:00 4/6/2022 State Capitol, Room 444)",2022-04-06,Introduced,"Ballot measures (initiative and referendum),Private funding"
2636,CA,AB2808,Elections: ranked choice voting.,"In committee: Set, first hearing. Held without recommendation.",2022-04-06,Introduced,Ranked-choice voting
144,CA,SB504,Elections: voter registration.,"Chaptered by Secretary of State. Chapter 14, Statutes of 2022.",2022-03-31,Enacted,"Absentee/mail-in ballot request processes,State appropriations,Legal causes of action,Voting by felons or incarcerated individuals,Voter registration,Military/UOCAVA voting"
2831,CA,SB1485,Elections: required filings.,Re-referred to Com. on E. & C.A.,2022-03-23,Introduced,"Ballot access for candidates,Ballot access deadlines"
2639,CA,SB1170,School district and community college district elections: signature requirements.,Referred to Coms. on ED. and E. & C.A.,2022-03-02,Introduced,"Municipal election procedures,State appropriations"
2618,CA,SB1185,Initiative measures: circulating title and summary.,Referred to Com. on RLS.,2022-03-02,Introduced,Ballot measures (initiative and referendum)
2586,CA,SB1151,Mail ballot elections.,Referred to Com. on RLS.,2022-02-23,Introduced,Absentee/mail-in ballot administration
2653,CA,AB2907,School districts: governing boards: elections.,From printer. May be heard in committee March 21.,2022-02-19,Introduced,Municipal election procedures
116,CA,AB1829,Voting: vote by mail systems.,Referred to Com. on ELECTIONS.,2022-02-18,Introduced,"Absentee/mail-in ballot administration,Transparency"
2613,CA,AB2396,Voters: registration.,From printer. May be heard in committee March 20.,2022-02-18,Introduced,Voter registration
2616,CA,AB2470,Special election dates.,From printer. May be heard in committee March 20.,2022-02-18,Introduced,Special election procedures
2615,CA,AB2467,Elections: recounts.,From printer. May be heard in committee March 20.,2022-02-18,Introduced,Recounts
114,CA,AB1693,Recall elections: contribution limits.,Referred to Com. on ELECTIONS.,2022-02-03,Introduced,"Recalls,State appropriations"
128,CA,AB446,Elections: political party qualifications.,Consideration of Governor's veto stricken from file.,2022-02-03,Vetoed,"Ballot access for parties,State appropriations"
134,CA,AB801,Elections: United States Senate vacancies.,From committee: Filed with the Chief Clerk pursuant to Joint Rule 56.,2022-02-01,Dead,Special election procedures
145,CA,SB511,Voter file maintenance: information from potential jurors.,Returned to Secretary of Senate pursuant to Joint Rule 56.,2022-02-01,Dead,Voter list maintenance
125,CA,AB241,Referendum measures.,From committee: Filed with the Chief Clerk pursuant to Joint Rule 56.,2022-02-01,Dead,Ballot measures (initiative and referendum)
137,CA,SB105,Online voter registration.,Returned to Secretary of Senate pursuant to Joint Rule 56.,2022-02-01,Dead,Voter registration
131,CA,AB728,Elections: county voter information guides.,From committee: Filed with the Chief Clerk pursuant to Joint Rule 56.,2022-02-01,Dead,"Voting materials,Election dates and administrative deadlines"
127,CA,AB372,Remote accessible vote by mail systems: testing and examination: report.,From committee: Filed with the Chief Clerk pursuant to Joint Rule 56.,2022-02-01,Dead,Transparency
130,CA,AB608,Permanent vote by mail: procedures.,Died at Desk.,2022-02-01,Dead,Absentee/mail-in ballot administration
157,CA,SB797,Elections: vote by mail ballots.,Returned to Secretary of Senate pursuant to Joint Rule 56.,2022-02-01,Dead,Absentee/mail-in ballot return processes
149,CA,SB597,Elections: vote by mail ballots.,Returned to Secretary of Senate pursuant to Joint Rule 56.,2022-02-01,Dead,"Voter ID for absentee/mail-in ballots,State appropriations"
159,CA,SB90,Elections: ballot label.,Returned to Secretary of Senate pursuant to Joint Rule 56.,2022-02-01,Dead,"Ballot measures (initiative and referendum),Voting materials,State appropriations"
152,CA,SB672,Remote accessible vote by mail systems: voters with disabilities.,Returned to Secretary of Senate pursuant to Joint Rule 56.,2022-02-01,Dead,"State appropriations,Absentee/mail-in voter assistance"
155,CA,SB77,Elections: ballots.,Returned to Secretary of Senate pursuant to Joint Rule 56.,2022-02-01,Dead,In-person voting and polling places
140,CA,SB295,District elections.,Returned to Secretary of Senate pursuant to Joint Rule 56.,2022-02-01,Dead,Municipal election procedures
104,CA,AB1303,Affidavits of registration.,Died at Desk.,2022-02-01,Dead,Voter registration
103,CA,AB1266,Voting: vote by mail voters.,Died at Desk.,2022-02-01,Dead,Provisional ballots
151,CA,SB663,Recall petitions.,Returned to Secretary of Senate pursuant to Joint Rule 56.,2022-02-01,Dead,"Ballot measures (initiative and referendum),Recalls,State appropriations"
129,CA,AB53,Election day holiday.,From committee: Filed with the Chief Clerk pursuant to Joint Rule 56.,2022-02-01,Dead,Time off for voting
150,CA,SB660,"Initiative, referendum, and recall petitions: compensation for signatures.",Veto sustained.,2022-01-27,Vetoed,"Recalls,Enforcement against non-officials"
148,CA,SB594,Elections: redistricting.,"Chaptered by Secretary of State. Chapter 320, Statutes of 2021.",2021-09-27,Enacted,"Election dates and administrative deadlines,Redistricting process"
141,CA,SB35,Elections.,"Chaptered by Secretary of State. Chapter 318, Statutes of 2021.",2021-09-27,Enacted,"Ballot access for candidates,Electioneering,State appropriations,Drop-box security"
133,CA,AB796,Voter registration: California New Motor Voter Program.,"Chaptered by Secretary of State - Chapter 314, Statutes of 2021.",2021-09-27,Enacted,Voter registration
106,CA,AB1495,Vacancy elections.,"Chaptered by Secretary of State - Chapter 316, Statutes of 2021.",2021-09-27,Enacted,"Special election procedures,Vacancy procedures,State appropriations"
126,CA,AB37,Elections: vote by mail ballots.,"Chaptered by Secretary of State - Chapter 312, Statutes of 2021.",2021-09-27,Enacted,"Absentee/mail-in ballot deadlines,Absentee/mail-in ballot request processes,Absentee/mail-in ballot return processes,State appropriations"
143,CA,SB503,Voting: ballots and signature verification.,"Chaptered by Secretary of State. Chapter 319, Statutes of 2021.",2021-09-27,Enacted,"Absentee/mail-in ballot return processes,Absentee/mail-in ballot administration,Transparency,Cure provisions,Signature matching"
153,CA,SB714,Democratic Party: county central committees: appointment and election.,"Chaptered by Secretary of State. Chapter 299, Statutes of 2021.",2021-09-24,Enacted,"Ballot access for candidates,Municipal election procedures,State appropriations"
132,CA,AB759,Elections: county officers.,Ordered to inactive file at the request of Senator Newman.,2021-09-08,Passed one chamber,"Municipal election procedures,State appropriations"
108,CA,AB1591,Elections omnibus bill.,"Chaptered by Secretary of State - Chapter 100, Statutes of 2021.",2021-07-16,Enacted,"Ballot design,Voter list maintenance"
147,CA,SB590,2022 statewide primary election: terms of office.,"Chaptered by Secretary of State. Chapter 107, Statutes of 2021.",2021-07-16,Enacted,Municipal election procedures
146,CA,SB583,Elections: Voter registration: California New Motor Voter Program.,June 30 set for first hearing canceled at the request of author.,2021-06-30,Passed one chamber,"State appropriations,Voter registration"
138,CA,SB152,Elections.,"Chaptered by Secretary of State. Chapter 34, Statutes of 2021.",2021-06-28,Enacted,"Absentee/mail-in ballot deadlines,Absentee/mail-in ballot return processes,Absentee/mail-in ballot administration,Municipal election procedures,In-person voting and polling places,State appropriations"
154,CA,SB729,Elections: polling places.,Re-referred to Com. on RLS. pursuant to Assembly Rule 96.,2021-06-17,Passed one chamber,In-person voting and polling places
139,CA,SB29,Elections: vote by mail ballots.,"Chaptered by Secretary of State. Chapter 3, Statutes of 2021.",2021-02-19,Enacted,"Absentee/mail-in ballot return processes,Municipal election procedures,State appropriations"
2785,CO,SB153,Internal Election Security Measures,Governor Signed,2022-06-02,Enacted,"Certification,State appropriations,Enforcement against officials,Enforcement against non-officials,Election officials,Voting equipment,Chain of custody,Video surveillance,Physical security,Cybersecurity"
2691,CO,HB1273,Protections For Elections Officials,Governor Signed,2022-06-02,Enacted,Enforcement against non-officials
163,CO,HB1204,Election Systems,"House Committee on State, Civic, Military, & Veterans Affairs Postpone Indefinitely",2022-03-14,Introduced,"Absentee/mail-in voting eligibility,Absentee/mail-in ballot return processes,Ballot design,Counting and canvassing procedures,In-person voting and polling places,Enforcement against non-officials,Legal causes of action,Voter list maintenance,Testing and certification,Digital/electronic voting"
164,CO,SB046,Parker Election Inclusion Or Exclusion From RTD Regional Transportation District,"Senate Committee on State, Veterans, & Military Affairs Postpone Indefinitely",2022-02-01,Dead,"Ballot measures (initiative and referendum),Municipal election procedures"
2841,CT,SB00471,An Act Concerning Elections And State Voting Rights.,File Number 454,2022-04-13,Advanced from committee,"Ranked-choice voting,Language accommodations,Municipal election procedures,Enforcement against non-officials,Legal causes of action,Redistricting criteria/requirements,Voting by felons or incarcerated individuals,Voter list maintenance,Redistricting process,In-person voter assistance"
2871,CT,HB05262,An Act Revising Certain Absentee Voting Eligibility Statutes.,Signed by the Governor,2022-04-08,Enacted,"Absentee/mail-in voting eligibility,Absentee/mail-in ballot return processes"
2976,DC,B24-0638,Advisory Neighborhood Commission Redistricting Deadline Extension Temporary Amendment Act of 2022,"Law Number L24-0130 Effective from Jun 30, 2022, Expires on Feb 10, 2023",2022-06-30,Enacted,"Reporting,Redistricting criteria/requirements"
3017,DC,B24-0839,Advisory Neighborhood Commission Redistricting Deadline Extension Congressional Review Emergency Amendment Act of 2022,"Final Reading, CC",2022-06-07,Enacted,"Election dates and administrative deadlines,Ballot access deadlines,Redistricting process"
2975,DC,B24-0637,Advisory Neighborhood Commission Redistricting Deadline Extension Emergency Amendment Act of 2022,"Act A24-0347 Published in DC Register Vol 69 and Page 002616, Expires on Jun 26, 2022",2022-04-01,Enacted,"Election dates and administrative deadlines,Ballot access deadlines,Redistricting process"
2971,DC,B24-0371,Ward Redistricting Amendment Act of 2021,"Law L24-0074, Effective from Feb 24, 2022 Published in DC Register Vol 69 and Page 002018",2022-03-18,Enacted,Redistricting
2974,DC,B24-0576,Ward Redistricting Emergency Amendment Act of 2021,"Act A24-0264 Published in DC Register Vol 69 and Page 000001, Expires on Mar 29, 2022",2022-01-07,Enacted,Redistricting
2973,DC,B24-0507,Elections Modernization Amendment Act of 2021,Public hearing held,2022-01-06,Introduced,"Absentee/mail-in ballot deadlines,Automatic mail-in ballots,Drop-box availability,In-person voting and polling places"
2972,DC,B24-0372,"Voter Ownership, Integrity, Choice, and Equity (VOICE) Amendment Act of 2021",Public hearing held,2021-11-18,Introduced,Ranked-choice voting
2970,DC,B24-0353,Voter Mobile App Amendment Act of 2021,Notice of Intent to Act on B24-0353 Published in the DC Register,2021-07-16,Introduced,Digital/electronic voting
167,DE,HB183,An Act To Amend Title 15 Of The Delaware Code Relating To Residency.,Passed By House. Votes: 40 YES 1 NOT VOTING,2022-07-01,Passed both chambers,Ballot access for candidates
3024,DE,SB320,An Act To Amend Title 15 Of The Delaware Code Relating To Elections.,Passed By House. Votes: 25 YES 12 NO 3 NOT VOTING 1 ABSENT,2022-06-29,Passed both chambers,"Absentee/mail-in ballot return processes,Absentee/mail-in ballot administration,Ballot design,Testing and certification"
2730,DE,SB233,An Act To Amend Title 15 Of The Delaware Code Relating To Municipal Elections.,Tabled in Committee,2022-06-22,Passed one chamber,"Municipal election procedures,Voter list maintenance"
171,DE,HB25,An Act To Amend Title 15 Of The Delaware Code Relating To Elections.,Passed By Senate. Votes: 14 YES 7 NO,2022-06-22,Passed both chambers,Same-day/Election Day registration
2770,DE,HB327,An Act To Amend Title 15 Of The Delaware Code Relating To Primary Elections.,Introduced and Assigned to Administration Committee in House,2022-03-08,Introduced,Primary systems
176,DE,SB215,An Act To Amend Title 15 Of The Delaware Code Relating To Elections.,signed by Governor,2022-02-07,Enacted,Redistricting process
172,DE,HB258,An Act To Amend Title 15 Of The Delaware Code Relating To Certificates Of Nomination For Minor Political Parties.,Administration (11:00 1/18/2022 ),2022-01-18,Introduced,Ballot access for parties
175,DE,SB177,An Act To Amend Title 15 Of The Delaware Code Relating To Elections.,signed by Governor,2021-09-30,Enacted,Ballot access for candidates
173,DE,HB29,An Act To Amend Title 15 Of The Delaware Code Relating To Changing Candidacy To A Different Office.,signed by Governor,2021-09-15,Enacted,Ballot access for candidates
177,DE,SB5,An Act To Amend Title 15 Of The Delaware Code Relating To Registration Of Voters.,signed by Governor,2021-06-30,Enacted,Automatic voter registration
166,DE,HB146,An Act To Amend Title 15 Of The Delaware Code Relating To Municipal Elections.,Amendment HA 1 to HB 146 - Introduced and Placed With Bill,2021-06-09,Introduced,"Municipal election procedures,Voter registration"
174,DE,HB30,An Act To Amend Title 15 Of The Delaware Code Relating To Primary Elections.,Assigned to Elections & Government Affairs Committee in Senate,2021-05-18,Passed one chamber,"Ballot access for candidates,Ballot access for parties,Election dates and administrative deadlines,Voter participation deadlines"
168,DE,HB187,An Act To Amend Title 15 Of The Delaware Code Relating To Conduct Of Elections And Admitting A Person To Vote.,Introduced and Assigned to Administration Committee in House,2021-05-18,Introduced,"In-person voter ID,Provisional ballots"
169,DE,HB188,An Act To Amend Title 15 Of The Delaware Code Relating To Fraudulent Voting.,Introduced and Assigned to Administration Committee in House,2021-05-18,Introduced,Legal causes of action
170,DE,HB189,An Act To Amend Title 15 Of The Delaware Code Relating To Requesting An Absentee Ballot.,Introduced and Assigned to Administration Committee in House,2021-05-18,Introduced,Voter ID for absentee/mail-in ballots
200,FL,S0524,Election Administration,Chapter No. 2022-73,2022-04-26,Enacted,"Absentee/mail-in ballot deadlines,Ranked-choice voting,Oversight and accountability,Ballot measures (initiative and referendum),Counting and canvassing procedures,Election dates and administrative deadlines,Private funding,Enforcement against officials,Enforcement against non-officials,Voter list maintenance"
2929,FL,S0002,Establishing the Congressional Districts of the State,Approved by Governor,2022-04-22,Enacted,Redistricting
2931,FL,H0001,Establishing the Congressional Districts of the State,"Laid on Table, refer to SB 2-C",2022-04-20,Advanced from committee,Redistricting
196,FL,S0102,Establishing the Congressional Districts of the State,Veto Message referred to Rules,2022-04-19,Vetoed,Redistricting
207,FL,S1228,Online Voter Registration of Students in Public High School,Died in Ethics and Elections,2022-03-14,Dead,Voter registration
212,FL,S1914,Elections,Died in Ethics and Elections,2022-03-14,Dead,"Election officials,Time off for voting,Voter registration"
209,FL,S1630,Recall of Statewide Executive Branch Officers,Died in Ethics and Elections,2022-03-14,Dead,Recalls
201,FL,S0694,Vote-by-mail Ballots,Died in Ethics and Elections,2022-03-14,Dead,Absentee/mail-in ballot return processes
210,FL,S1722,Elections,Died in Ethics and Elections,2022-03-14,Dead,"Absentee/mail-in ballot request processes,Voter participation deadlines,Legal causes of action,Voter registration"
178,FL,H0035,Partisan Elections for Members of District School Boards,Died in Secondary Education & Career Development Subcommittee,2022-03-14,Dead,"Municipal election procedures,Nonpartisan elections"
197,FL,S0244,Partisan Elections for Members of District School Boards,Died in Education,2022-03-14,Dead,"Ballot access for candidates,Nonpartisan elections"
198,FL,S0368,Voter Registration,Died in Ethics and Elections,2022-03-14,Dead,"Voter participation deadlines,Voter registration"
208,FL,S1586,Elections,Died in Ethics and Elections,2022-03-14,Dead,"Absentee/mail-in ballot request processes,Special election procedures,Election dates and administrative deadlines,Voter registration"
179,FL,H0099,Forensic Audit of the 2020 General Election,Died in Public Integrity & Elections Committee,2022-03-14,Dead,Audits
188,FL,H6105,Elections,Died in Public Integrity & Elections Committee,2022-03-14,Dead,"Absentee/mail-in ballot request processes,Absentee/mail-in ballot administration,Drop-box availability,Voter participation deadlines,Electioneering,Private funding,Enforcement against officials,Legal causes of action,Voter registration,Drop-box security"
204,FL,S1004,Recall of County Officers and Commissioners,Died in Community Affairs,2022-03-14,Dead,Recalls
211,FL,S1850,Election of Commissioner of Insurance,Died in Ethics and Elections,2022-03-14,Dead,Vacancy procedures
181,FL,H0663,Recall of County Officers and Commissioners,Died in State Affairs Committee,2022-03-14,Dead,"Municipal election procedures,Recalls"
183,FL,H0983,Pub. Rec./Voters and Voter Registration,Died in Public Integrity & Elections Committee,2022-03-14,Dead,"Voter registration,Voter list maintenance"
186,FL,H1399,Recall of County Commissioners,Died in State Affairs Committee,2022-03-14,Dead,"Municipal election procedures,Recalls"
213,FL,S1938,Recall of County Officials,Died in Community Affairs,2022-03-14,Dead,Recalls
182,FL,H0903,Online Voter Registration of Students in Public High School,Died in Public Integrity & Elections Committee,2022-03-14,Dead,Voter registration
185,FL,H1353,Elections,Died in Public Integrity & Elections Committee,2022-03-14,Dead,"Absentee/mail-in ballot deadlines,Absentee/mail-in ballot request processes,Absentee/mail-in ballot return processes,Absentee/mail-in ballot administration,Oversight and accountability,Ballot access for candidates,Voter ID for absentee/mail-in ballots,Signature matching,Ballot design,Voting materials,Special election procedures,Vacancy procedures,Counting and canvassing procedures,Early voting administration,Election dates and administrative deadlines,In-person voting and polling places,Provisional ballots,Electioneering,Election officials,Legal causes of action,Time off for voting,Voter registration,Voter list maintenance,Voting equipment"
184,FL,H1217,Elections,Died in Public Integrity & Elections Committee,2022-03-14,Dead,"Absentee/mail-in ballot request processes,Permanent lists,Special election procedures,Election dates and administrative deadlines,Voter registration"
191,FL,H7061,Elections,"Laid on Table, refer to CS/CS/SB 524",2022-03-08,Advanced from committee,"Absentee/mail-in ballot deadlines,Ranked-choice voting,Ballot measures (initiative and referendum),Election dates and administrative deadlines,Enforcement against officials,Enforcement against non-officials,Voter list maintenance,In-person voter assistance"
2643,FL,H7503,Establishing the Congressional Districts of the State,Laid on Table,2022-03-03,Advanced from committee,Redistricting
206,FL,S1194,Local Tax Referenda Requirements,"Laid on Table, refer to CS/CS/HB 777",2022-03-02,Advanced from committee,"Ballot measures (initiative and referendum),Municipal election procedures"
195,FL,S0100,Joint Resolution of Apportionment,Signed by Officers and filed with Secretary of State,2022-02-16,Enacted,Redistricting
194,FL,H7501,Joint Resolution of Apportionment,Laid on Table,2022-02-02,Introduced,Redistricting
2888,GA,HB1612,Elections; provide for additional form of identification for voting,House Second Readers,2022-04-04,Introduced,In-person voter ID
393,GA,SB89,"Elections and Primaries; chief elections assistance officer; qualifications, appointment, supervision, and duties; provide",House Passed/Adopted By Substitute,2022-04-04,Passed both chambers,"Oversight and accountability,Time off for voting,Physical security"
2713,GA,HB1464,Georgia Bureau of Investigation; original jurisdiction to investigate election fraud and elections crimes; provide,Senate read second time,2022-03-30,Passed one chamber,Time off for voting
345,GA,HB933,Elections; retention and preservation of ballots and other elections documents; revise provisions,House Governmental Affairs Committee (meeting Upon Adjournment Of The House Of Representatives) (15:30 3/9/2022 406 CLOB HYBRID),2022-03-09,Introduced,Physical security
2751,GA,HB1490,Elections; afford employees time off to vote on days of advance voting in addition to election days,House Second Readers,2022-03-08,Introduced,Time off for voting
348,GA,HB975,Elections; probate court judge to cease acting as superintendent of elections; provisions,House Governmental Affairs General Government Subcommittee (10:00 3/7/2022 506 CLOB HYBRID),2022-03-07,Introduced,"Oversight and accountability,State appropriations,Election officials"
2712,GA,HB1462,Elections; reporting of residential property sales to board of registrars by tax receiver or tax commissioner; provide,House Second Readers,2022-03-03,Introduced,Voter list maintenance
2669,GA,HB1410,Elections; electors who are visually disabled may vote electronically; provide,House Second Readers,2022-02-28,Introduced,Voting equipment
2645,GA,HB1401,Elections; certain individuals challenging an elector's name appearing on list of electors shall not be liable for such challenge; provide,House Second Readers,2022-02-24,Introduced,Voter list maintenance
218,GA,HB1085,Elections; option for municipalities to adopt and use instant runoff voting; provide,House Committee Favorably Reported,2022-02-24,Advanced from committee,"Ranked-choice voting,Municipal election procedures"
2646,GA,HB1402,Elections; private donations by state and local governmental entities for election purposes; prohibit solicitation and acceptance,House Second Readers,2022-02-24,Introduced,Private funding
2644,GA,HB1392,Georgia Bureau of Investigation; original jurisdiction to investigate election fraud and election crimes; provide,House Second Readers,2022-02-24,Introduced,Legal causes of action
2654,GA,SB538,Elections and Primaries; fraud countermeasures on physical absentee ballots; require,Senate Read and Referred,2022-02-22,Introduced,"Voting materials,State appropriations"
2607,GA,HB1356,Elections; disqualification of persons to serve as poll watchers under certain circumstances; provide,House Second Readers,2022-02-17,Introduced,Poll observers
2587,GA,SB517,Primaries and Elections; qualifications for absentee electors; provide,Senate Read and Referred,2022-02-17,Introduced,"Absentee/mail-in voting eligibility,Absentee/mail-in ballot return processes,Absentee/mail-in ballot administration,Drop-box availability"
2588,GA,SB527,Primaries and Elections; the option for municipalities and consolidated governments to adopt and use instant runoff voting for their elections; provide,Senate Read and Referred,2022-02-17,Introduced,"Ranked-choice voting,Municipal election procedures,Counting and canvassing procedures"
2608,GA,HB1359,Elections; sealing of ballots and unused security paper in secure containers; provide,House Second Readers,2022-02-17,Introduced,"Chain of custody,Physical security"
230,GA,HB1317,Elections; absentee ballot drop boxes; remove provisions,House Second Readers,2022-02-14,Introduced,Drop-box availability
231,GA,HB1318,Elections; superintendent may permit any elector of the county to vote in any precinct of the county which such elector chooses; provide,House Second Readers,2022-02-14,Introduced,"In-person voting and polling places,Voting equipment"
382,GA,SB444,Primaries and Elections; the number of absentee ballot drop boxes which may be utilized in a primary or election; remove the limitation,Senate Read and Referred,2022-02-03,Introduced,Drop-box availability
220,GA,HB1107,Crisp County; probate judge; provide nonpartisan elections,House Second Readers,2022-02-03,Introduced,"Municipal election procedures,Nonpartisan elections"
380,GA,SB442,Primaries and Elections; electors may choose to permanently receive absentee ballots; provide,Senate Read and Referred,2022-02-03,Introduced,Permanent lists
219,GA,HB1096,Elections; drop boxes for use in returning absentee ballots; provide,House Second Readers,2022-02-02,Introduced,Drop-box availability
343,GA,HB886,Elections; sealing of ballots and unused security paper in secure containers; provide,House Committee Favorably Reported By Substitute,2022-01-27,Introduced,"Chain of custody,Physical security"
346,GA,HB941,Elections; comprehensively revise by repealing 2021 Act No. 9; provisions,House Second Readers,2022-01-26,Introduced,"Absentee/mail-in ballot request processes,Absentee/mail-in ballot return processes,Absentee/mail-in ballot administration,Ranked-choice voting,Poll observers,Oversight and accountability,States of emergency,Ballot access for candidates,Special election procedures,Counting and canvassing procedures,Certification,Early voting duration,In-person voting and polling places,Provisional ballots,Electioneering,Election workers/volunteers,Election officials,Legal causes of action,Challenges,Voter list maintenance,Testing and certification"
370,GA,SB325,Elections and Primaries; relating to absentee ballot drop boxes and the requirements; remove provisions,Senate Read and Referred,2022-01-25,Introduced,Drop-box availability
372,GA,SB350,Elections; local legislation for nonpartisan elections for any county offices; authorize the General Assembly,Senate Read and Referred,2022-01-25,Introduced,Nonpartisan elections
344,GA,HB887,Revenue and taxation; authorize assessment of residential homesteaded property owned by individuals who are 65 years of age or older at 20 percent of its fair market value; provide for local referenda,House Second Readers,2022-01-14,Introduced,Ballot measures (initiative and referendum)
356,GA,SB178,Elections and Primaries; absentee ballot applications shall not be sent without first receiving a request for such an application from such elector; provide,Senate Recommitted,2022-01-10,Introduced,Absentee/mail-in ballot request processes
394,GA,SB93,Elections and Primaries; use of portable and movable polling facilities in certain circumstances; provide,Senate Recommitted,2022-01-10,Introduced,In-person voting and polling places
388,GA,SB71,"Elections and Primaries; the definition of ""absentee elector""; revise; reasons for voting by absentee ballot; provide",Senate Recommitted,2022-01-10,Introduced,Absentee/mail-in voting eligibility
349,GA,SB141,Elections and Primaries; immediate counting and tabulation of ballots after the close of the polls until such counting and tabulation is completed; provide,Senate Recommitted,2022-01-10,Introduced,Counting and canvassing procedures
361,GA,SB232,Primaries and Elections; unique bar codes on individual absentee ballots; require,Senate Recommitted,2022-01-10,Introduced,Voting materials
329,GA,HB531,Elections; no election superintendents or boards of registrars shall accept private funding; provide,Senate Recommitted,2022-01-10,Passed one chamber,Private funding
386,GA,SB69,Primaries and Elections; persons desiring to register to vote or update their voter registration through and application for a driver's license; indicate such desire on such application; provide,Senate Recommitted,2022-01-10,Introduced,Voter registration
237,GA,HB270,Elections; mailing and issuance of absentee ballots; provide time periods,"House Withdrawn, Recommitted",2021-03-31,Introduced,Absentee/mail-in ballot deadlines
369,GA,SB314,Primaries and Elections; registered voters to cast a ballot at any polling place; provide,Senate Read and Referred,2021-03-29,Introduced,In-person voting and polling places
360,GA,SB202,Elections and Primaries; persons or entities that mail absentee ballot applications shall mail such applications only to eligible registered electors; provide,Effective Date 2021-03-25,2021-03-25,Enacted,"Absentee/mail-in ballot deadlines,Absentee/mail-in ballot request processes,Absentee/mail-in ballot return processes,Absentee/mail-in ballot administration,Drop-box availability,Ranked-choice voting,Poll observers,Oversight and accountability,Transparency,Ballot access for candidates,Voter ID for absentee/mail-in ballots,Voting materials,Vacancy procedures,Counting and canvassing procedures,Certification,Recounts,Early voting administration,Early voting duration,In-person voting and polling places,Provisional ballots,Electioneering,Election workers/volunteers,Election officials,Legal causes of action,Challenges,Voting equipment,Redistricting process,Military/UOCAVA voting,Testing and certification,Physical security"
341,GA,HB786,Elections; manner of filling vacancies in party nominations; revise,House Second Readers,2021-03-25,Introduced,"Ballot access for candidates,Special election procedures,Vacancy procedures,Counting and canvassing procedures,In-person voting and polling places"
340,GA,HB785,Elections; provide definitions; provisions for certain counties and municipalities,House Second Readers,2021-03-25,Introduced,"Language accommodations,Ballot design,Voter registration"
363,GA,SB241,Elections and Voting; revise comprehensively,House Second Readers,2021-03-10,Passed one chamber,"Absentee/mail-in voting eligibility,Absentee/mail-in ballot deadlines,Absentee/mail-in ballot administration,Audits,Poll observers,Oversight and accountability,Voter ID for absentee/mail-in ballots,Early voting administration,In-person voting and polling places,Enforcement against officials,Election officials,Legal causes of action,Voter registration"
383,GA,SB62,Elections and Primaries; name and designation of the precinct appears on every ballot; provide,House Second Readers,2021-03-10,Passed one chamber,"Voting materials,Chain of custody,Physical security,Cybersecurity"
364,GA,SB253,Elections and Primaries; notice when polling places are relocated; provide,House Second Readers,2021-03-10,Passed one chamber,In-person voting and polling places
391,GA,SB74,Elections and Primaries; ability of poll watchers at tabulating centers to observe the vote counting process; revise,House Second Readers,2021-03-10,Passed one chamber,"Poll observers,Counting and canvassing procedures"
389,GA,SB72,"Elections and Primaries; county registrars shall obtain monthly from the coroner, judge of the probate court, and funeral homes in the county identifying information about persons who died in the county during the previous month; provide",House Second Readers,2021-03-10,Passed one chamber,Voter list maintenance
338,GA,HB726,Elections; ability of judge of probate court to cease acting as superintendent of elections; provide,House Second Readers,2021-03-09,Introduced,"Oversight and accountability,State appropriations,Election officials"
337,GA,HB701,State Election Board; suspending superintendents; provide additional powers,House Second Readers,2021-03-05,Introduced,"Oversight and accountability,Enforcement against officials"
336,GA,HB659,"Elections; scanning and publishing of paper ballots, unofficial precinct returns, and ballots from recounts; provisions",House Second Readers,2021-03-03,Introduced,Transparency
367,GA,SB273,Elections and Primaries; conduct elections by paper ballots in 2021; authorize local governments,Senate Read and Referred,2021-03-03,Introduced,"Municipal election procedures,Voting equipment"
366,GA,SB269,Elections and Primaries; the manner of selection of the members of the State Election Board; change,Senate Read and Referred,2021-03-01,Introduced,"Oversight and accountability,Election officials"
384,GA,SB67,Elections and Primaries; submission of identification in connection with absentee ballot applications; provide,House Second Readers,2021-02-25,Passed one chamber,"Absentee/mail-in ballot request processes,Voter ID for absentee/mail-in ballots,Signature matching"
357,GA,SB184,Elections and Primaries; inputting credit for voting data; revise the time,House Second Readers,2021-02-25,Passed one chamber,"Legal causes of action,Voter registration"
358,GA,SB188,Elections and Primaries; election results reporting system to be established and maintained by the Secretary of State; provide,House Second Readers,2021-02-25,Passed one chamber,Certification
377,GA,SB40,Elections and Primaries; the time and method for opening and tabulating absentee ballots; revise,House Second Readers,2021-02-25,Passed one chamber,Counting and canvassing procedures
332,GA,HB615,Elections; automatic recount and recanvass under certain circumstances; provide,House Second Readers,2021-02-25,Introduced,Recounts
362,GA,SB233,Primaries and Elections; new voting systems for use in elections in this state; provide,Senate Read and Referred,2021-02-23,Introduced,"Audits,In-person voting and polling places,State appropriations,Voting equipment"
330,GA,HB537,Elections; notices; boards of registrars; absentee ballots; provisions,House Second Readers,2021-02-23,Introduced,"Voter ID for absentee/mail-in ballots,Voting materials,Enforcement against officials,Video surveillance"
250,GA,HB491,State Election Board; power to adopt emergency rules and regulations; provide additional requirements,House Second Readers,2021-02-22,Introduced,States of emergency
326,GA,HB506,State Election Board; promulgate minimum standards for voting equipment; provide,House Second Readers,2021-02-22,Introduced,Voting equipment
254,GA,HB501,Elections; recounts shall count the text portions of ballots; provide,House Second Readers,2021-02-22,Introduced,Recounts
328,GA,HB512,Elections; revise times for advance voting,House Second Readers,2021-02-22,Introduced,Early voting duration
252,GA,HB493,State Election Board; assume temporary control over local election and voter registration administration; provide,House Second Readers,2021-02-22,Introduced,"Oversight and accountability,Election officials"
251,GA,HB492,State Election Board; make Secretary of State a nonvoting ex officio member,House Second Readers,2021-02-22,Introduced,"Oversight and accountability,Election officials"
253,GA,HB494,Elections; submission of photocopies of voter identification documents for absentee voting; provide,House Second Readers,2021-02-22,Introduced,Voter ID for absentee/mail-in ballots
327,GA,HB507,Elections; distribution of absentee ballot applications by third-party entities; regulate,House Second Readers,2021-02-22,Introduced,"Absentee/mail-in ballot request processes,Absentee/mail-in ballot administration,Legal causes of action"
248,GA,HB472,Elections; revise manner of giving notice of changes in voter registration,House Second Readers,2021-02-18,Introduced,Voter registration
249,GA,HB484,Georgia Voting Rights Act; enact,House Second Readers,2021-02-18,Introduced,"Oversight and accountability,Ballot design,Early voting duration,Election dates and administrative deadlines,Redistricting commissions,Time off for voting,Voting equipment,Redistricting process,Same-day/Election Day registration"
359,GA,SB192,"Elections and Primaries; hearings and procedures when the right of a person to register to vote, vote, or remain on the list of electors is challenged; provide",Senate Read and Referred,2021-02-17,Introduced,"Voter registration,Voter list maintenance"
247,GA,HB461,Elections; opening and tabulating absentee ballots; revise time and method,House Second Readers,2021-02-17,Introduced,Counting and canvassing procedures
353,GA,SB175,Elections and Primaries; submission of certain forms of identification by electors with absentee ballot applications; provide,Senate Read and Referred,2021-02-16,Introduced,Absentee/mail-in ballot request processes
354,GA,SB176,Elections and Primaries; increased penalties for certain election fraud; provide,Senate Read and Referred,2021-02-16,Introduced,Legal causes of action
246,GA,HB406,Elections; audits of certain primaries and elections; provide,House Second Readers,2021-02-16,Introduced,Audits
355,GA,SB177,"Elections and Primaries; definition of ""absentee elector""; revise; reasons for voting by absentee ballot",Senate Read and Referred,2021-02-16,Introduced,Absentee/mail-in voting eligibility
350,GA,SB147,"Elections and Primaries; counties and municipalities; advance voting on Saturday and Sunday prior to the day of a primary, election, or runoff; provide",Senate Read and Referred,2021-02-11,Introduced,Early voting duration
244,GA,HB366,Elections; registration through an application for driver's license; provisions,House Second Readers,2021-02-11,Introduced,Voter registration
243,GA,HB365,Elections; printed absentee ballot applications shall have the election cycle for which they are to be used printed on the application; provide,House Second Readers,2021-02-11,Introduced,Voting materials
245,GA,HB373,Elections; county registrars obtain information about persons who died in the county during the previous month; provide,House Second Readers,2021-02-11,Introduced,Voter list maintenance
352,GA,SB150,Elections and Primaries; automatic voter registration in certain circumstances; provide,Senate Read and Referred,2021-02-11,Introduced,Automatic voter registration
351,GA,SB149,Primaries and Elections; same day registration and voting; provide,Senate Read and Referred,2021-02-11,Introduced,Same-day/Election Day registration
242,GA,HB326,Elections; voting devices or systems used in this state shall not utilize any form of wireless network cards or wireless technology; provide,House Second Readers,2021-02-10,Introduced,Voting equipment
241,GA,HB325,Elections; revise definition of absentee elector,House Second Readers,2021-02-10,Introduced,Absentee/mail-in voting eligibility
395,GA,SB99,"Elections and Primaries; all advance voting locations shall be open and available for voting on the day of a primary, election, or runoff for any elector of the county to vote; provide",Senate Read and Referred,2021-02-08,Introduced,"In-person voting and polling places,Voting equipment"
240,GA,HB285,Elections; instant run-off voting in the election of presidential electors; provide,House Second Readers,2021-02-08,Introduced,"Ranked-choice voting,Presidential elections"
239,GA,HB284,Elections; counties and municipalities may choose to utilize instant run-off voting under certain circumstances; provide,House Second Readers,2021-02-08,Introduced,Ranked-choice voting
238,GA,HB280,Elections; certain electors list maintenance activities; eliminate,House Second Readers,2021-02-08,Introduced,Voter list maintenance
236,GA,HB267,Elections; persons who register to vote by mail shall vote for the first time in person; provide,House Second Readers,2021-02-08,Introduced,"In-person voting and polling places,Voter registration"
235,GA,HB250,Elections; advanced voting locations in the period prior to an election; limit changes,House Second Readers,2021-02-04,Introduced,"Absentee/mail-in ballot administration,Early voting administration"
392,GA,SB79,"Registration of Voters; felonies involving moral turpitude; shall not register to, remain registered to, or vote",Senate Read and Referred,2021-02-03,Introduced,"Voting by felons or incarcerated individuals,Voter registration,Voter list maintenance"
234,GA,HB227,Elections; submission of identification in connection with absentee ballot applications; provide,House Second Readers,2021-02-03,Introduced,"Absentee/mail-in ballot request processes,Voter ID for absentee/mail-in ballots"
390,GA,SB73,Elections and Primaries; absentee ballot applications to certain election officials and candidates; limit the distribution,Senate Read and Referred,2021-02-02,Introduced,Absentee/mail-in ballot request processes
385,GA,SB68,Elections and Primaries; manner of delivery of voted absentee ballots; revise,Senate Read and Referred,2021-02-02,Introduced,Chain of custody
387,GA,SB70,Elections and Primaries; a person who votes in a general election for office of US Representative or US Senate in another state; ineligible to vote in a runoff for any such offices in this state in the same election cycle; provide,Senate Read and Referred,2021-02-02,Introduced,Voter registration
232,GA,HB132,Elections; written operating procedures for elections and voter registration activities in each county; provide,House Second Readers,2021-01-29,Introduced,"Oversight and accountability,In-person voting and polling places,Enforcement against officials"
233,GA,HB136,Elections; appointment of acting election superintendents in the event of a vacancy in the office of judge of the probate court; provisions,House Second Readers,2021-01-29,Introduced,Vacancy procedures
222,GA,HB113,Elections; same day registration and voting; provide,House Second Readers,2021-01-28,Introduced,Same-day/Election Day registration
373,GA,SB36,Elections and Primaries; development of a pilot program; rural counties; establishing and funding the operation of advance voting location in such counties; provide,Senate Read and Referred,2021-01-28,Introduced,"In-person voting and polling places,State appropriations"
368,GA,SB29,Elections and Primaries; submission of certain forms of identification by electors with absentee ballot applications and absentee ballots; provide,Senate Read and Referred,2021-01-28,Introduced,Voter ID for absentee/mail-in ballots
371,GA,SB35,Elections and Primaries; qualifications of poll officers; revise,Senate Read and Referred,2021-01-28,Introduced,"Election workers/volunteers,Election officials"
375,GA,SB37,Agreement Among the States to Elect the President by National Popular Vote; enact,Senate Read and Referred,2021-01-28,Introduced,Presidential elections
376,GA,SB38,Primaries and Elections; permanent absentee voter list; provide,Senate Read and Referred,2021-01-28,Introduced,Permanent lists
226,GA,HB121,Elections; certain electors list maintenance activities; eliminate,House Second Readers,2021-01-28,Introduced,Voter list maintenance
365,GA,SB26,Elections and Primaries; absentee ballot drop boxes at every advance voting location; provide,Senate Read and Referred,2021-01-27,Introduced,Drop-box availability
339,GA,HB77,Elections; superintendent may permit any elector of the county to vote in any precinct of the county which such elector chooses; provide,House Second Readers,2021-01-26,Introduced,In-person voting and polling places
334,GA,HB64,Elections; manner of handling the death of a candidate prior to a nonpartisan election; provide,House Second Readers,2021-01-14,Introduced,Vacancy procedures
333,GA,HB62,Elections; boards and superintendents accept and expend private funds; prohibit,House Second Readers,2021-01-14,Introduced,Private funding
335,GA,HB65,Elections; date of nonpartisan general elections for certain offices; change,House Second Readers,2021-01-14,Introduced,Nonpartisan elections
331,GA,HB59,Elections; instant runoff voting by overseas citizens and military personnel; authorize,House Second Readers,2021-01-13,Introduced,"Ranked-choice voting,Military/UOCAVA voting"
3014,HI,SB2162,Relating To Ranked Choice Voting.,"Act 047, on 06/17/2022 (Gov. Msg. No. 1147).",2022-06-17,Enacted,"Ranked-choice voting,Special election procedures"
2920,HI,HB1471,Relating To Political Parties.,"Act 004, 04/07/2022 (Gov. Msg. No. 1104).",2022-04-07,Enacted,"Ballot access for parties,Ballot access deadlines"
2681,HI,SB2046,Relating To Political Parties.,"Referred to JHA, referral sheet 24",2022-03-10,Passed one chamber,"Ballot access for parties,Ballot access deadlines"
396,HI,HB853,Relating To Voting.,Carried over to 2022 Regular Session.,2021-12-10,Introduced,"Drop-box availability,Poll observers,Voting equipment,Drop-box security"
2622,IA,SF2343,"A bill for an act relating to the conduct of elections, including provisions related to absentee ballots, recounts, and contested gubernatorial elections and impeachments, making penalties applicable, and including effective date and applicability provisions.(Formerly SSB 3143.)",Fiscal note.,2022-04-07,Advanced from committee,"Absentee/mail-in ballot request processes,Absentee/mail-in ballot return processes,Absentee/mail-in ballot administration,Audits,Transparency,Ballot access for candidates,Recalls,Counting and canvassing procedures,Recounts,Election dates and administrative deadlines,Legislative authority,Physical security"
2670,IA,HF2526,"A bill for an act relating to the conduct of elections, including provisions related to absentee ballots, recounts, and contested gubernatorial elections and impeachments, making penalties applicable, and including effective date and applicability provisions.(Formerly HSB 719.)",Fiscal note.,2022-04-07,Introduced,"Absentee/mail-in ballot return processes,Absentee/mail-in ballot administration,Audits,Transparency,Ballot access for candidates,Ballot design,Recalls,Counting and canvassing procedures,Certification,Recounts,Election dates and administrative deadlines,Legislative authority"
2623,IA,HSB719,"A bill for an act relating to the conduct of elections, including provisions related to absentee ballots, recounts, and contested gubernatorial elections and impeachments, making penalties applicable, and including effective date and applicability provisions.","Committee report approving bill, renumbered as HF 2526.",2022-02-23,Advanced from committee,"Absentee/mail-in ballot request processes,Absentee/mail-in ballot return processes,Absentee/mail-in ballot administration,Audits,Transparency,Ballot access for candidates,Ballot access for parties,Ballot design,Recalls,Vacancy procedures,Counting and canvassing procedures,Certification,Recounts,Election dates and administrative deadlines,Provisional ballots,Legislative authority,Physical security"
755,IA,SSB3143,"A bill for an act relating to the conduct of elections, including provisions related to absentee ballots, recounts, and contested gubernatorial elections and impeachments, making penalties applicable, and including effective date and applicability provisions.","Committee report approving bill, renumbered as SF 2343.",2022-02-17,Advanced from committee,"Absentee/mail-in ballot return processes,Absentee/mail-in ballot administration,Audits,Transparency,Ballot access for candidates,Primary systems,Recalls,Special election procedures,Counting and canvassing procedures,Recounts,Reporting,Challenges"
743,IA,HF2354,"A bill for an act relating to the conduct of elections, including the counting and recounting of ballots and the certification of results.","Introduced, referred to State Government. H.J. 236",2022-02-10,Introduced,"Counting and canvassing procedures,Recounts,Election dates and administrative deadlines"
748,IA,SF413,"A bill for an act relating to the conduct of elections, including absentee ballots and voter list maintenance activities, making penalties applicable, and including effective date and applicability provisions. (Formerly SSB 1199.) Effective date: 03/08/2021. Applicability date: 01/01/2022.",Fiscal note.,2021-06-28,Enacted,"Absentee/mail-in ballot request processes,Absentee/mail-in ballot return processes,Absentee/mail-in ballot administration,Ballot access for candidates,Ballot access for parties,Special election procedures,Election dates and administrative deadlines,In-person voting and polling places,Enforcement against officials,Election officials,Legal causes of action,Voter registration,Voter list maintenance,Ballot collection,In-person voter assistance,Physical security"
750,IA,SF568,"A bill for an act relating to the conduct of elections, including nominations, procedures for proposed amendments to the Iowa Constitution, and absentee voting, and including effective date provisions. (Formerly SSB 1237.) Effective date: Enactment, 01/01/2022.",Signed by Governor. S.J. 1150.,2021-06-08,Enacted,"Absentee/mail-in ballot return processes,Absentee/mail-in ballot administration,Transparency,Ballot access for candidates,Ballot measures (initiative and referendum),Ballot design,Special election procedures,Counting and canvassing procedures,Election dates and administrative deadlines,Provisional ballots,Election officials,Voter registration,Voter list maintenance,Ballot collection,Military/UOCAVA voting"
749,IA,SF531,A bill for an act relating to the conduct of elections during emergencies. (Formerly SSB 1204.),Rereferred to State Government. H.J. 1203.,2021-05-20,Passed one chamber,States of emergency
753,IA,SSB1237,"A bill for an act relating to the conduct of elections, including nominations and procedures for proposed amendments to the Iowa Constitution, and including effective date provisions.(See SF 568.)","Committee report approving bill, renumbered as SF 568.",2021-03-04,Introduced,"Absentee/mail-in ballot return processes,Ballot access for candidates,Ballot measures (initiative and referendum),Vacancy procedures,Counting and canvassing procedures,Election dates and administrative deadlines,Provisional ballots,Election officials"
752,IA,SSB1204,A bill for an act relating to the conduct of elections during emergencies.(See SF 531.),"Committee report approving bill, renumbered as SF 531.",2021-03-02,Introduced,States of emergency
744,IA,HF590,"A bill for an act relating to the conduct of elections, including absentee ballots and voter list maintenance activities, making penalties applicable, and including effective date provisions.(Formerly HSB 213.)",Withdrawn. H.J. 545.,2021-02-24,Introduced,"Absentee/mail-in ballot request processes,Absentee/mail-in ballot return processes,Absentee/mail-in ballot administration,Transparency,States of emergency,Ballot access for parties,Nonpartisan elections,Counting and canvassing procedures,Election dates and administrative deadlines,Enforcement against officials,Election officials,Legal causes of action,Voter registration,Voter list maintenance,Ballot collection,Physical security"
747,IA,SF382,"A bill for an act relating to the conduct of elections, including the recounting of ballots, the mailing of absentee ballots, and in-person absentee voting.","Subcommittee: R. Smith, Cournoyer, and Jochum. S.J. 445.",2021-02-23,Introduced,"Absentee/mail-in ballot request processes,Absentee/mail-in ballot administration,Recounts,Election dates and administrative deadlines"
751,IA,SSB1199,"A bill for an act relating to the conduct of elections, including absentee ballots and voter list maintenance activities, making penalties applicable, and including effective date provisions.(See SF 413.)","Committee report approving bill, renumbered as SF 413.",2021-02-18,Introduced,"Absentee/mail-in ballot deadlines,Absentee/mail-in ballot request processes,Absentee/mail-in ballot return processes,Oversight and accountability,Ballot access for candidates,Ballot access for parties,Election dates and administrative deadlines,Enforcement against officials,Election officials,Legal causes of action,Voter registration,Voter list maintenance,Ballot collection"
745,IA,HSB213,"A bill for an act relating to the conduct of elections, including absentee ballots and voter list maintenance activities, making penalties applicable, and including effective date provisions.(See HF 590.)","Committee report approving bill, renumbered as HF 590.",2021-02-18,Introduced,"Absentee/mail-in ballot request processes,Absentee/mail-in ballot return processes,Absentee/mail-in ballot administration,States of emergency,Ballot access for parties,Nonpartisan elections,Counting and canvassing procedures,Election dates and administrative deadlines,Enforcement against officials,Election officials,Legal causes of action,Voter list maintenance,Ballot collection,In-person voter assistance"
2692,ID,H0682,"Adds to existing law to require notification of boundary changes for election zones, districts, and subdistricts.","Reported Signed by Governor on March 25, 2022 Session Law Chapter 257 Effective: 07/01/2022",2022-03-31,Enacted,Redistricting
2916,ID,S1289,Adds to existing law to authorize either or both houses of the Legislature to intervene in certain actions regarding constitutionality of an Idaho statute.,Session Law Chapter 226 Effective: 07/01/2022,2022-03-25,Enacted,Legislative authority
401,ID,H0548,Amends and adds to existing law to provide that a person's residence for voting purposes shall be the homestead for which the person claims a certain tax exemption and to provide for an investigation into candidate qualifications.,"Reported Signed by Governor on March 21, 2022 Session Law Chapter 81 Effective: 03/21/2022",2022-03-22,Enacted,Voter registration
400,ID,H0532,Adds to and amends existing law to allow the Secretary of State or a county clerk to petition for judicial review of an election when it appears that an error occurred in the administration of the election and the error might be sufficient to change the outcome of the election.,"Reported Signed by Governor on March 18, 2022 Session Law Chapter Effective:",2022-03-21,Enacted,Oversight and accountability
2782,ID,H0761,"Amends, repeals, and adds to existing law to revise provisions regarding voter identification.","Introduced, read first time; referred to: State Affairs",2022-03-15,Passed one chamber,"In-person voter ID,Voter ID for registration,Voter registration,Same-day/Election Day registration"
397,ID,H0441,Adds to existing law to provide for absentee ballot assistance at certain facilities and to prohibit certain actions.,House State Affairs Committee (09:00 3/11/2022 Room EW40),2022-03-11,Introduced,Absentee/mail-in voter assistance
406,ID,S1274,Amends and adds to existing law to provide for postelection audits of selected paper ballots in certain elections by the Secretary of State.,Session Law Chapter 32 Effective: 03/11/2022,2022-03-11,Enacted,Audits
2752,ID,S1375,Amends existing law to revise provisions regarding voter identification and registration.,Senate State Affairs Committee (08:00 3/11/2022 Room WW55),2022-03-11,Introduced,"In-person voter ID,Voter ID for registration,Voter registration,Same-day/Election Day registration"
2701,ID,H0692,Amends and adds to existing law to revise provisions regarding identification for voter registration and voting purposes.,U.C. to be returned to State Affairs Committee,2022-03-07,Advanced from committee,"In-person voter ID,Voter ID for registration"
2682,ID,H0439,Amends existing law to revise provisions regarding the deadline to change political party affiliation or unaffiliated designation.,"Introduced, read first time; referred to: State Affairs",2022-02-22,Passed one chamber,"Voter participation deadlines,Voter registration"
2655,ID,H0671,Amends existing law to provide for the filling of certain school board trustee vacancies.,"Introduced, read first time, referred to JRA for Printing",2022-02-21,Introduced,"Municipal election procedures,Vacancy procedures"
402,ID,H0549,"Amends, repeals, and adds to existing law to revise provisions regarding voter identification to register to vote and to cast ballots.",Reported Printed and Referred to State Affairs,2022-02-08,Introduced,"In-person voter ID,Voter participation deadlines,Provisional ballots,Voter registration"
399,ID,H0487,"Amends existing law to revise provisions regarding the sealing and storage of ballots in the event of a challenge, recount, or contest.",Reported Printed and Referred to Ways & Means,2022-01-31,Introduced,Counting and canvassing procedures
398,ID,H0459,Amends existing law to provide for automatic voter registration through the Division of Motor Vehicles.,Reported Printed and Referred to Ways & Means,2022-01-25,Introduced,Voter registration
405,ID,S1230,"Amends, adds to, and repeals existing law to provide for nonpartisan primary elections and ranked-choice voting in general elections.",Reported Printed; referred to State Affairs,2022-01-21,Introduced,"Ranked-choice voting,Non-traditional primaries,Primary systems"
2580,ID,H0438,Amends existing law to revise provisions regarding filling vacant school trustee positions following a recall or resignation resulting from a recall petition.,Reported Printed and Referred to State Affairs,2022-01-14,Introduced,"Municipal election procedures,Recalls,Vacancy procedures"
596,IL,SB2949,ELECTIONS VOTER PHOTO ID,Added as Co-Sponsor Sen. Win Stoller,2022-05-09,Introduced,In-person voter ID
615,IL,SB3429,ELEC CD-DIGITAL SIGN-PETITION,Chief Sponsor Changed to Sen. Don Harmon,2022-04-30,Introduced,Voting equipment
539,IL,SB0681,ELECT CODE-REFERENDA,Chief Sponsor Changed to Sen. Don Harmon,2022-04-30,Introduced,Ballot measures (initiative and referendum)
614,IL,SB3425,ELECTION CD-VARIOUS PENALTIES,Chief Sponsor Changed to Sen. Don Harmon,2022-04-30,Introduced,Enforcement against non-officials
457,IL,HB2808,ELEC CODE-REGISTRATION,Added Co-Sponsor Rep. Chris Miller,2022-04-08,Introduced,Voter ID for registration
2887,IL,SB4200,ELEC CD-USE OF FUNDS,Added as Co-Sponsor Sen. Sue Rezin,2022-04-04,Introduced,Legal causes of action
616,IL,SB3432,ELEC CD-REGISTRATION,Added as Co-Sponsor Sen. Omar Aquino,2022-03-30,Introduced,"Noncitizen voting,Voter registration"
506,IL,HB4536,ELEC CD-VARIOUS,Added Chief Co-Sponsor Rep. Paul Jacobs,2022-03-22,Introduced,"Audits,Oversight and accountability,Transparency,Ballot access for candidates,Legal causes of action,Voter list maintenance"
493,IL,HB4068,ELECTIONS-RIGHTS OF VOTERS,Added Co-Sponsor Rep. Michael Kelly,2022-03-21,Introduced,"Transparency,Language accommodations,Legal causes of action"
524,IL,HB4966,ELECTION CD-DIGITAL SIGNATURES,Added Co-Sponsor Rep. La Shawn K. Ford,2022-03-10,Introduced,"Ballot measures (initiative and referendum),Voting equipment"
450,IL,HB2601,ELEC CD-VOTE BY MAIL BALLOTS,Added Co-Sponsor Rep. Dan Ugaste,2022-03-03,Introduced,Absentee/mail-in ballot deadlines
2684,IL,SB4180,ST BD EDUC-ELECT MEMBERS,Added as Co-Sponsor Sen. Dan McConchie,2022-03-02,Introduced,"Municipal election procedures,Nonpartisan elections"
588,IL,SB2606,ELECTIONS-TECH,Died In Committee,2022-03-01,Dead,Bills without substantive content
451,IL,HB2602,ELEC CD-REPORTING TO ISBE,Added Co-Sponsor Rep. Tim Butler,2022-02-24,Introduced,Transparency
526,IL,HB5141,ELEC CD-REGISTRATION,Added Chief Co-Sponsor Rep. Eva Dina Delgado,2022-02-24,Introduced,"Voter ID for registration,Noncitizen voting"
449,IL,HB2600,ELEC CD-VOTE BY MAIL,Added Co-Sponsor Rep. Tim Butler,2022-02-24,Introduced,"Absentee/mail-in ballot administration,Cure provisions,Signature matching"
447,IL,HB2598,ELEC CD-DECEASED VOTERS,Added Co-Sponsor Rep. Tim Butler,2022-02-24,Introduced,Voter list maintenance
448,IL,HB2599,ELECTIONS VOTER PHOTO ID,Added Co-Sponsor Rep. Tim Butler,2022-02-24,Introduced,In-person voter ID
423,IL,HB1920,ELEC CD-CHANGE OF ADDRESS,Added Co-Sponsor Rep. Tim Butler,2022-02-24,Introduced,Voter list maintenance
497,IL,HB4339,ELEC CD-PRE-REGISTRATION,Added Co-Sponsor Rep. Aaron M. Ortiz,2022-02-22,Introduced,Voter registration
530,IL,HB5497,ELECTION CODE-BALLOT FORMAT,Rule 19(a) / Re-referred to Rules Committee,2022-02-18,Introduced,Ballot design
505,IL,HB4491,ELECTION CD-PUBLIC QUESTIONS,Rule 19(a) / Re-referred to Rules Committee,2022-02-18,Introduced,Ballot measures (initiative and referendum)
443,IL,HB2462,ELEC CODE-DECEASED VOTER,Rule 19(a) / Re-referred to Rules Committee,2022-02-18,Introduced,Voter list maintenance
426,IL,HB1973,ELECTIONS VOTER PHOTO ID,Rule 19(a) / Re-referred to Rules Committee,2022-02-18,Introduced,In-person voter ID
422,IL,HB1902,ELEC CODE-VOTER SIGNATURE,Rule 19(a) / Re-referred to Rules Committee,2022-02-18,Introduced,"In-person voter ID,Voter ID for low-income voters"
514,IL,HB4852,ELECTION CD-OBJECTION NOTICE,Rule 19(a) / Re-referred to Rules Committee,2022-02-18,Introduced,"Ballot access for candidates,Ballot measures (initiative and referendum)"
518,IL,HB4856,ELECTION CD-VOTE CENTERS,Rule 19(a) / Re-referred to Rules Committee,2022-02-18,Introduced,In-person voting and polling places
433,IL,HB2445,ELECTIONS VOTER PHOTO ID,Rule 19(a) / Re-referred to Rules Committee,2022-02-18,Introduced,In-person voter ID
510,IL,HB4775,ELECTION CD-JUDGE'S INITIAL,Rule 19(a) / Re-referred to Rules Committee,2022-02-18,Introduced,Oversight and accountability
516,IL,HB4854,ELECTION CD-ELECTION PRECINCTS,Rule 19(a) / Re-referred to Rules Committee,2022-02-18,Introduced,In-person voting and polling places
509,IL,HB4761,ELECTION CODE-EARLY VOTING,Rule 19(a) / Re-referred to Rules Committee,2022-02-18,Introduced,Absentee/mail-in ballot deadlines
511,IL,HB4787,COUNTY EXECUTIVE FORM-BOARD,Rule 19(a) / Re-referred to Rules Committee,2022-02-18,Introduced,Vacancy procedures
500,IL,HB4467,ELECTION BALLOT RANDOMIZATION,Rule 19(a) / Re-referred to Rules Committee,2022-02-18,Introduced,Ballot design
496,IL,HB4310,ELEC CD-VOTER REGISTRATION,Rule 19(a) / Re-referred to Rules Committee,2022-02-18,Introduced,Voter list maintenance
520,IL,HB4858,GENERAL ELECTION DAY,Rule 19(a) / Re-referred to Rules Committee,2022-02-18,Introduced,Time off for voting
515,IL,HB4853,ELECTION-INCAPACITATED ELECTOR,Rule 19(a) / Re-referred to Rules Committee,2022-02-18,Introduced,Absentee/mail-in ballot deadlines
517,IL,HB4855,ELECT CODE-ELECTION JUDGES,Rule 19(a) / Re-referred to Rules Committee,2022-02-18,Introduced,Election workers/volunteers
499,IL,HB4419,ELEC CD-SOCIALIST ORGS,Rule 19(a) / Re-referred to Rules Committee,2022-02-18,Introduced,Ballot access for candidates
525,IL,HB5104,ELEC CD-BALLOT SECURITY,Rule 19(a) / Re-referred to Rules Committee,2022-02-18,Introduced,"Video surveillance,Physical security"
531,IL,HB5518,ELECT-MUNI ELECT COMM,Rule 19(a) / Re-referred to Rules Committee,2022-02-18,Introduced,Municipal election procedures
495,IL,HB4137,ELEC CODE-VOTER REGISTRATION,Rule 19(a) / Re-referred to Rules Committee,2022-02-18,Introduced,"Voter registration,Voter list maintenance"
527,IL,HB5249,ELECTIONS-VARIOUS,Rule 19(a) / Re-referred to Rules Committee,2022-02-18,Introduced,"Certification,Reporting,Voter list maintenance"
507,IL,HB4747,ELEC CD-CANCEL REGISTRATION,Rule 19(a) / Re-referred to Rules Committee,2022-02-18,Introduced,Voter list maintenance
519,IL,HB4857,ELECTIONS-VOTE BY MAIL NOTICE,Rule 19(a) / Re-referred to Rules Committee,2022-02-18,Introduced,Permanent lists
528,IL,HB5276,CITIZENS EMPOWERMENT ACT,To Clean Energy Subcommittee,2022-02-15,Introduced,Ballot measures (initiative and referendum)
740,IL,SB3969,ELECTION-INCAPACITATED ELECTOR,Rule 3-9(a) / Re-referred to Assignments,2022-02-10,Introduced,"In-person voter assistance,Absentee/mail-in voter assistance"
562,IL,SB1785,ELEC CD-RANKED CHOICE VOTING,Senate Committee Amendment No. 1 Rule 3-9(a) / Re-referred to Assignments,2022-02-10,Introduced,Ranked-choice voting
566,IL,SB1907,ELEC CD-MAIL BALLOT/DISABILITY,Rule 3-9(a) / Re-referred to Assignments,2022-02-10,Introduced,Absentee/mail-in ballot request processes
731,IL,SB3780,ELEC CD-BALLOT PRINTING,Rule 3-9(a) / Re-referred to Assignments,2022-02-10,Introduced,Ballot design
738,IL,SB3967,ELECTION CD-OBJECTION NOTICE,Rule 3-9(a) / Re-referred to Assignments,2022-02-10,Introduced,"Ballot access for candidates,Challenges"
739,IL,SB3968,GENERAL ELECTION DAY,Rule 3-9(a) / Re-referred to Assignments,2022-02-10,Introduced,Time off for voting
737,IL,SB3966,ELECT CODE-ELECTION JUDGES,Rule 3-9(a) / Re-referred to Assignments,2022-02-10,Introduced,Oversight and accountability
741,IL,SB3970,ELECTION CD-VOTE BY MAIL,Rule 3-9(a) / Re-referred to Assignments,2022-02-10,Introduced,Absentee/mail-in ballot administration
735,IL,SB3964,ELECTION CD-VOTE CENTERS,Rule 3-9(a) / Re-referred to Assignments,2022-02-10,Introduced,In-person voting and polling places
734,IL,SB3963,ELECTION CD-ELECTION PRECINCTS,Rule 3-9(a) / Re-referred to Assignments,2022-02-10,Introduced,In-person voting and polling places
729,IL,SB3647,ELECT CODE-CANDIDATE OATH,Rule 3-9(a) / Re-referred to Assignments,2022-02-10,Introduced,Ballot access for candidates
727,IL,SB3599,ELEC CD-PRE-REGISTRATION,Rule 3-9(a) / Re-referred to Assignments,2022-02-10,Introduced,Voter registration
736,IL,SB3965,ELECTIONS-VOTE BY MAIL NOTICE,Rule 3-9(a) / Re-referred to Assignments,2022-02-10,Introduced,Permanent lists
730,IL,SB3687,ELECT CODE-DEEP FAKE VIDEO,Rule 3-9(a) / Re-referred to Assignments,2022-02-10,Introduced,Legal causes of action
570,IL,SB2038,ELECTIONS-PAPER BALLOTS ONLY,Rule 3-9(a) / Re-referred to Assignments,2022-02-10,Introduced,"Counting and canvassing procedures,Chain of custody,Cybersecurity"
501,IL,HB4484,ELECTIONS VOTER PHOTO ID,Added Co-Sponsor Rep. Tom Weber,2022-02-01,Introduced,In-person voter ID
529,IL,HB5448,ELECTIONS-TECH,Referred to Rules Committee,2022-01-31,Introduced,Private funding
508,IL,HB4748,ELEC CD-EQUIPMENT/AUDITS,Referred to Rules Committee,2022-01-27,Introduced,"Audits,Voting equipment"
742,IL,SB3984,ELECTION CODE-VARIOUS,Referred to Assignments,2022-01-21,Introduced,Voter list maintenance
504,IL,HB4487,ELECTION CODE-VOTER ROLLS,Referred to Rules Committee,2022-01-21,Introduced,Voter list maintenance
502,IL,HB4485,ELEC CD-AUDIT OF BALLOTS,Referred to Rules Committee,2022-01-21,Introduced,Audits
498,IL,HB4400,ELEC CD-VOTE BY MAIL,Referred to Rules Committee,2022-01-21,Introduced,"Reporting,Chain of custody"
503,IL,HB4486,ELEC CD-BALLOT TRACKING,Referred to Rules Committee,2022-01-21,Introduced,"Absentee/mail-in ballot return processes,Cybersecurity"
726,IL,SB3547,ELECTIONS-TECH,Referred to Assignments,2022-01-19,Introduced,Bills without substantive content
725,IL,SB3546,ELECTIONS-TECH,Referred to Assignments,2022-01-19,Introduced,Primary systems
604,IL,SB3314,ELECTIONS-TECH,Referred to Assignments,2022-01-14,Introduced,Bills without substantive content
611,IL,SB3321,ELECTIONS-TECH,Referred to Assignments,2022-01-14,Introduced,Bills without substantive content
610,IL,SB3320,ELECTIONS-TECH,Referred to Assignments,2022-01-14,Introduced,Bills without substantive content
609,IL,SB3319,ELECTIONS-TECH,Referred to Assignments,2022-01-14,Introduced,Bills without substantive content
608,IL,SB3318,ELECTIONS-TECH,Referred to Assignments,2022-01-14,Introduced,Bills without substantive content
607,IL,SB3317,ELECTIONS-TECH,Referred to Assignments,2022-01-14,Introduced,Bills without substantive content
606,IL,SB3316,ELECTIONS-TECH,Referred to Assignments,2022-01-14,Introduced,Bills without substantive content
605,IL,SB3315,ELECTIONS-TECH,Referred to Assignments,2022-01-14,Introduced,Bills without substantive content
603,IL,SB3239,ELECTIONS-TECH,Referred to Assignments,2022-01-14,Introduced,Bills without substantive content
602,IL,SB3221,ELECTIONS-TECH,Referred to Assignments,2022-01-14,Introduced,Bills without substantive content
601,IL,SB3220,ELECTIONS-TECH,Referred to Assignments,2022-01-14,Introduced,Bills without substantive content
